HunterFirst;"Привет, ученик
В лесу много стражников
Будь осторожнее, если тебя схватят, тебя повесят
С нашем городе стало неспокойно с тех пор, как сменился король…
Жестокие стражники короля не дают покоя народу
Чтобы его свергнуть, мы должны найти сообщников в городе"
HunterSecond;"У тебя хорошо получается
Ты большой молодец
Продолжай в том же духе"
DarkPactFound;"Что это такое?
О боже…
Мэр заключил контракт с дьяволом
И этот странный амулет…
Пожалуй, заберу его с собой
Нужно рассказать всем о связе мэра с дьяволом!"
DarkPactNoTime;"Почему я все еще мешкаю?
Глашатай уже в комнате
Быстрее в окно!"
